{"created_at":"2026-10-05T16:53:43.145625+00:00","gates":{"HARD_INVARIANTS":"PASS","L0_SCHEMA_MECHANISM":"PASS","L1_RETRIEVAL":"PASS","L2_TRAJECTORY":"PASS","L3_ENVIRONMENT":"PASS","L4_ANSWER_QUALITY":"PASS","TASK_SUCCESS":"PASS"},"git_sha":"83514ebad336dbd6faf1b790c597ec8037be0874","lockfile_digests":{"uv.lock":"56cb85435d685072840e046db441aa8067e85b6157b4ef797adf761229bc8e4d","web/package-lock.json":"979de678d1aa068f967d80cc8ccdeaf827988f129eaed75dcad573cf27de7630"},"scenario_set_digest":"ad14a89fb5816f2eea2ab700394df4b231191cb466e4b326437d035e34f475f9","schema_version":"1.0"}